{
  "$schema": "../schemas/files-schema.json",
  "feature_id": "feature-user-auth",
  "updated_at": "2024-01-15T10:30:00Z",

  "summary": {
    "total_files": 12,
    "new_files": 8,
    "modified_files": 4,
    "deleted_files": 0,
    "lines_added": 845,
    "lines_removed": 23
  },

  "files": [
    {
      "path": "src/lib/auth.ts",
      "status": "new",
      "lines_added": 120,
      "lines_removed": 0,
      "last_modified": "2024-01-14T16:30:00Z",
      "purpose": "Core authentication utilities"
    },
    {
      "path": "src/app/api/auth/[...nextauth]/route.ts",
      "status": "new",
      "lines_added": 85,
      "lines_removed": 0,
      "last_modified": "2024-01-14T14:00:00Z",
      "purpose": "NextAuth API route handler"
    },
    {
      "path": "src/components/auth/LoginButton.tsx",
      "status": "new",
      "lines_added": 45,
      "lines_removed": 0,
      "last_modified": "2024-01-15T09:00:00Z",
      "purpose": "Login button component"
    },
    {
      "path": "src/components/auth/LogoutButton.tsx",
      "status": "new",
      "lines_added": 35,
      "lines_removed": 0,
      "last_modified": "2024-01-15T09:15:00Z",
      "purpose": "Logout button component"
    },
    {
      "path": "src/components/auth/UserMenu.tsx",
      "status": "new",
      "lines_added": 78,
      "lines_removed": 0,
      "last_modified": "2024-01-15T10:00:00Z",
      "purpose": "User dropdown menu"
    },
    {
      "path": "src/hooks/useAuth.ts",
      "status": "new",
      "lines_added": 52,
      "lines_removed": 0,
      "last_modified": "2024-01-14T15:00:00Z",
      "purpose": "Authentication hook"
    },
    {
      "path": "src/middleware.ts",
      "status": "modified",
      "lines_added": 35,
      "lines_removed": 5,
      "last_modified": "2024-01-14T17:00:00Z",
      "purpose": "Added auth middleware"
    },
    {
      "path": "src/types/auth.ts",
      "status": "new",
      "lines_added": 28,
      "lines_removed": 0,
      "last_modified": "2024-01-14T11:00:00Z",
      "purpose": "Authentication type definitions"
    },
    {
      "path": "src/app/layout.tsx",
      "status": "modified",
      "lines_added": 15,
      "lines_removed": 8,
      "last_modified": "2024-01-15T10:30:00Z",
      "purpose": "Added SessionProvider wrapper"
    },
    {
      "path": "prisma/schema.prisma",
      "status": "modified",
      "lines_added": 42,
      "lines_removed": 0,
      "last_modified": "2024-01-13T14:00:00Z",
      "purpose": "Added User and Session models"
    },
    {
      "path": ".env.example",
      "status": "modified",
      "lines_added": 8,
      "lines_removed": 0,
      "last_modified": "2024-01-13T10:00:00Z",
      "purpose": "Added auth environment variables"
    },
    {
      "path": "src/tests/auth.test.ts",
      "status": "new",
      "lines_added": 302,
      "lines_removed": 0,
      "last_modified": "2024-01-15T10:15:00Z",
      "purpose": "Authentication test suite"
    }
  ],

  "conflicts": {
    "potential": [],
    "detected": [],
    "resolved": []
  },

  "impact_analysis": {
    "affected_modules": ["auth", "middleware", "database"],
    "breaking_changes": false,
    "requires_migration": true,
    "security_sensitive": true
  }
}
